title,abstract,correlations
Implementation of baby boomer hepatitis C screening and linking to care in gastroenterology practices: a multi-center pilot study,"Background: Estimates suggest that only 20 % of HCV-infected patients have been identified and <10 % treated. However, baby boomers (1945-1965) are identified as having a higher prevalence of HCV which has led the Centers for Disease Control and Prevention to make screening recommendations. The aim of this study was to implement the CDC's screening recommendations in the unique setting of gastroenterology practices in patients previously unscreened for HCV.Methods: After obtaining patient informed consent, demographics, clinical and health-related quality of life (HRQOL) data were collected. A blood sample was screened for HCV antibody (HCV AB) using the OraQuick HCV Rapid Antibody Test. HCV AB-positive patients were tested for presence of HCV RNA and, if HCV RNA positive, patients underwent treatment discussions.Results: We screened 2,000 individuals in 5 gastroenterology centers located close to large metropolitan areas on the East Coast (3 Northeast, 1 Mid-Atlantic and 1 Southeast). Of the screened population, 10 individuals (0.5 %) were HCV AB-positive. HCV RNA testing was performed in 90 % (9/10) of HCV AB-positive individuals. Of those, 44.4 % (4/9) were HCV RNA-positive, and all 4 (100 %) were linked to caregiver. Compared to HCV AB negative subjects, HCV AB-positive individuals tended to be black (20.0 vs. 5.2 %, p = 0.09) and reported significantly higher rates of depression: 60.0 vs. 21.5 %, p = 0.009. These individuals also reported a significantly lower HRQOL citing having more fatigue, poorer concentration, and a decreased level of energy (p < 0.05).Discussion: Although the prevalence of HCV AB-positive was low in previously unscreened subjects screened in the gastroenterology centers, the linkage to care was very high. The sample of patients used in this study may be biased, so further studies are needed to assess the effectiveness of the CDC screening recommendations.Conclusion: Implementation of the Baby Boomer Screening for HCV requires identifying screening environement with high prevalence of HCV+ individuals as well as an efficient process of linking them to care.",0
A multi-facet approach to functional and ergonomic assessment of passive exoskeletons,"Seeing the innovative character of exoskeletal devices, it appears that there is yet progress to be made in adopting exoskeletons to industry, and to the different users' characteristics and needs. Their validation is mainly focused on technological aspects and seldom researchers presented methodological approaches including both physical and cognitive impact on operators, synergically with functional issues. This study proposes a multi-faced approach to investigate the impact of passive exoskeletons on functional and ergonomic aspects providing a preliminary experimental validation with an industrial task. The approach assesses the physical comfort, muscular fatigue, cognitive workload, and users' technological acceptance, to map the overall user experience (UX). Participants were monitored by a mechanomyogram (MMG) and a motion capture (MoCap) system and a UX questionnaire was administered. Results demonstrated the effectiveness of passive exoskeletons regarding the specific task being strictly related to a correct definition of the level of assistance for each user. (c) 2024 The Authors. Published by Elsevier B.V",0
Combating Threat-Alert Fatigue with Online Anomaly Detection Using Isolation Forest,"The threat-alert fatigue problem, which is the inability of security operators to genuinely investigate each alert coming from network-based intrusion detection systems, causes many unexplored alerts and hence a deterioration of the quality of service. Motivated by this pressing need to reduce the number of threat-alerts presented to security operators for manual investigation, we propose a scheme that can triage alerts of significance from massive threat-alert logs. Thanks to the fully unsupervised nature of the adopted isolation forest method, the proposed scheme does not require any prior labeling information and thus is readily adaptable for most enterprise environments. Moreover, by taking advantage of the temporal information in the alerts, it can be used in an online mode that takes in the most recent information from past alerts and predicts the incoming ones. We evaluated the performance of our scheme using a 10-month dataset consisting of more than half a million alerts collected in a real-world enterprise environment and found that it could screen out 87.41% of the alerts without missing any single significant ones. This study demonstrates the efficacy of unsupervised learning in screening minor threat-alerts and is expected to shed light on the threat-alert fatigue problem.",0
"Osteomuscular symptoms on motorcycles in the city of Rio Branco, Acre, Brazil, West Amazon","Musculoskeletal disorders gradually affect workers in different parts of the world, compromising their occupational health and quality of life. Professionals exposed to these symptoms include the motorcycle taxi driver, whose pain is due to the overuse of the musculoskeletal system and little time to recover it. To identify the prevalence of musculoskeletal symptoms in motorcycle taxi drivers in the city of Rio Branco, Acre, Brazil, West Amazon. Cross-sectional study, involving 296 motorcycle taxi drivers in the city of Rio Branco-Acre, Brazil, male, from December 2016 to February 2017. The Nordic Musculoskeletal Questionnaire was used to collect information related to symptoms (pain, discomfort, or numbness) in the last 7 days of work. For the exclusion criteria were, being female; not reside outside the city of Rio Branco, Acre; having less than 3 months of work activity; not be carrying out their work activities at the time of application of the protocol; be limited by clinical or physical issues at the time of application of the protocol. The data obtained in the questionnaire were entered into the Epidata program (Epidata Association, Odense, Denmark) and then transferred to the STATA 10 statistical program (Stata Corp., College Station), for categorization and statistical analysis. The study population is over 36 years old; most reported having a partner and a higher education level. The average daily working hours of the participants were 12 hours, with the majority working over 12 hours daily. Most of the epidemiological variables factors were associated with musculoskeletal pain when the prevalence and prevalence ratio analyzes were performed. Higher prevalence of musculoskeletal symptoms in the lumbar region is with 17.9%. In the lower limbs, the most affected joint was the ankle (5.7%), followed by the hip (5.07%) and knee (5.07%), respectively. Insomnia was present in 55.35% and self-reported headache in 49.4% of participants. The musculoskeletal disorders generated by the daily service of motorcycle taxi drivers are directly affecting the quality of life of these professionals.",0
"Knowledge Gaps, Challenges, and Opportunities in Health and Prevention Research for Asian Americans, Native Hawaiians, and Pacific Islanders: A Report From the 2021 National Institutes of Health Workshop","Asian Americans (AsA), Native Hawaiians, and Pacific Islanders (NHPI) comprise 7.7% of the U.S. population, and AsA have had the fastest growth rate since 2010. Yet the National Institutes of Health (NIH) has invested only 0.17% of its budget on AsA and NHPI research between 1992 and 2018. More than 40 ethnic subgroups are included within AsA and NHPI (with no majority subpopulation), which are highly diverse culturally, demographically, linguistically, and socioeconomically. However, data for these groups are often aggregated, masking critical health disparities and their drivers. To address these issues, in March 2021, the National Heart, Lung, and Blood Institute, in partnership with 8 other NIH institutes, convened a multidisciplinary workshop to review current research, knowledge gaps, opportunities, barriers, and approaches for prevention research for AsA and NHPI populations. The workshop covered 5 domains: 1) sociocultural, environmental, psychological health, and lifestyle dimensions; 2) metabolic disorders; 3) cardiovascular and lung diseases; 4) cancer; and 5) cognitive function and healthy aging. Two recurring themes emerged: Very limited data on the epidemiology, risk factors, and outcomes for most conditions are available, and most existing data are not disaggregated by subgroup, masking variation in risk factors, disease occurrence, and trajectories. Leveraging the vast phenotypic differences among AsA and NHPI groups was identified as a key opportunity to yield novel clues into etiologic and prognostic factors to inform prevention efforts and intervention strategies. Promising approaches for future research include developing collaborations with community partners, investing in infrastructure support for cohort studies, enhancing existing data sources to enable data disaggregation, and incorporating novel technology for objective measurement. Research on AsA and NHPI subgroups is urgently needed to eliminate disparities and promote health equity in these populations.",0
Choice of Health Options In prevention of Cardiovascular Events for people with Atrial Fibrillation (CHOICE-AF): A pilot study,"Background: Atrial fibrillation (AF), the most common cardiac arrhythmia, is associated with high risk of stroke and significant health burden. Recent emerging evidence suggests that modifying risk factor profiles of people with AF may assist to reduce stroke risk and health burden.Aims: The purpose of this study was to test the feasibility of a brief telephone-based program targeted at improving cardiovascular risk, and health-related quality of life (HRQoL) in patients with AFMethods: This was a pilot study of a brief three-month telephone-based intervention for patients with diagnosed AF. During an initial face-to-face consultation participants were assisted to set individualized risk factor reduction goals and a treatment plan. Participants received phone-based follow-up for three months, with final assessment at three months.Results: Nineteen participants with AF were recruited, with age range 35-82 years (mean 6513 years) and 53% were male. No changes were observed in either body mass index (BMI) or waist circumference measures. Participation was associated with significant improvement in reported symptom severity (p=0.005). There were non-significant improvements in physical activity, sedentary behavior, HRQoL, anxiety and depression.Conclusions: Participation in the CHOICE-AF pilot study did not improve BMI or waist circumference: however, it was associated with significant improvement in reported symptom severity. Further research is required to determine the most appropriate model of care for addressing risk factor management for people with AF.",0
Employer-mandated obstructive sleep apnea treatment and healthcare cost savings among truckers,"Objective: To evaluate the effect of an employer-mandated obstructive sleep apnea (OSA) diagnosis and treatment program on non-OSA-program trucker medical insurance claim costs.Methods: Retrospective cohort analysis; cohorts constructed by matching (randomly, with replacement) Screen-positive Controls (drivers with insurance screened as likely to have OSA, but not yet diagnosed) with Diagnosed drivers (n = 1,516; cases = 1,224, OSA Negatives = 292), on two factors affecting exposure to medical claims: experience level at hire and weeks of job tenure at the Diagnosed driver's polysomnogram (PSG) date (the matching date). All cases received auto-adjusting positive airway pressure (APAP) treatment and were grouped by objective treatment adherence data: any Positive Adherence (n = 932) versus No Adherence (n = 292). Bootstrap resampling produced a difference-in-differences estimate of aggregate non-OSA-program medical insurance claim cost savings for 100 Diagnosed drivers as compared to 100 Screen-positive Controls before and after the PSG/matching date, over an 18-month period. A two-part multivariate statistical model was used to set exposures and demographics/anthropometrics equal across sub-groups, and to generate a difference-in-differences comparison across periods that identified the effect of OSA treatment on per-member per-month (PMPM) costs of an individual driver, separately from cost differences associated with adherence choice.Results: Eighteen-month non-OSA-program medical claim costs savings from diagnosing (and treating as required) 100 Screen-positive Controls: $153,042 (95% CI: -$5,352, $330,525). Model-estimated effect of treatment on those adhering to APAP: -$441 PMPM (95% CI: -$861, -$21).Conclusions: Results suggest a carrier-based mandatory OSA program generates substantial savings in non-OSA-program medical insurance claim costs.",0
Effects of navigation method on workload and performance in simulated high-speed ship navigation,"This study examines mental workload and performance in simulated high-speed ship navigation. Two navigation methods were compared based oil ail electronic chart display and information system (ECDIS) and a conventional System using paper charts. Twenty naval cadets navigated in high-fidelity Simulators through a 50 nautical Mile Course with varying levels of difficulty. Results showed that ECDIS navigation significantly improved course-keeping performance, but reduced the total amount Of Communication oil the bridge. No differences were observed in subjective workload between groups. Heart rate variability and skin conductance Measurements indicated higher workload in conventional navigation, but the differences between groups were not significant. (C) 2008 Elsevier Ltd. All rights reserved.",0
The impact of water cleaning on boiler tube life,"Water cleaning of boiler walls has proven effective at removing PRB coal ash from them. But the procedure has a big downside: repeated doses of thermal stress that can cause boiler tubes to crack and leak. A new, real-time hardware/software tool can help cleaning system operators maximize the effectiveness of the process while minimizing the cumulative negative impact of cyclic stress.",0
An Anatomically Based Analysis of Objectively Measured Pediatric Snoring: A Pilot Study,"Objective To assess pediatric habitual snoring (PS) using home sleep test (HST) technology and attempt to correlate the objective components of PS to specific upper airway anatomy. In addition, the effects of adenotonsillectomy ( turbinoplasty) on objective measures of PS were evaluated.Study Design Prospective cohort study.Setting Tertiary medical center.Subjects and Methods Pediatric patients with a chief complaint of snoring and probable obstructive sleep apnea underwent an HST (SNAP Diagnostics, Wheeling, Illinois) with a detailed acoustical snoring analysis prior to adenotonsillectomy ( turbinoplasty). During surgery, detailed anatomical measurements were performed and correlated to snoring analysis results. After surgery, patients were offered another HST with snoring analysis. Data analysis was performed using descriptive statistics and statistical correlation with attention to the multiple-comparisons paradox.Results Twenty-two patients (45% male; mean age, 5.4 years [range, 2.4-8.4 years]) completed the preoperative HST and operative measurements. Unlike typical adult snoring, only a minority of PS was from palatal flutter (mean palatal component, 24%; median, 10%). The resistance occurrence percentage (ROP, percentage of breathing events with snoring noise) was associated with body mass index (BMI; Spearman = 0.55; P = .017), subjective turbinate size (0.54; P = .032), palatal obstruction (0.63; P = .008), and mean oxygen saturation (-0.729; P = .0003) but not adenotonsillar hypertrophy. Twelve patients (54%) completed a postoperative HST. The ROP was significantly reduced (median, 20.5% vs 6.5%; P = .006, sign rank test) postoperatively. The magnitude of the ROP reduction was proportional to the volume of the removed tonsils (0.74; P = .022).Conclusion Pediatric snoring has different acoustical characteristics than adult snoring. Objective PS is associated with BMI, turbinate size, and palatal obstruction. Adenotonsillectomy (+/- turbinoplasty) may significantly reduce objective PS.",0
The development of 'Make One Small Change': an e-health intervention for the workplace developed using the Person-Based Approach,"Background The application of digital health interventions is widespread and many employers are implementing employee e-health programs. Intended to enhance productivity by increasing wellbeing, workplace interventions often lack evidence of effectiveness and have low rates of retention. Use of the person-based approach (PBA) is one solution, which offers a systematic framework for developing effective digital health interventions. This paper describes the application of the PBA to the development of 'Make one small change' (Cigna MSC (TM)), an online behaviour change system for lifestyle habits focused on resilience, movement, eating and sleep. Method and results The development of Cigna MSC (TM) took place over four stages with colleagues (n = 79) across Cigna globally. Application of the PBA entailed using high amounts of qualitative data to inform development and a cyclical process of 'listening, applying and delivering' was adhered to throughout. Early stages involved review of current literature and the collection of feedback in relation to existing interventions. Combined, results revealed key intervention development issues that were then used to form guiding principles. Guiding principles ensured intervention objectives translated into relevant design features. The final stages of evaluation included testing images, text and content approaches. Feedback dictated that the intervention should be fun, easy to use and include milestones for self-monitoring. The resulting version was finalised and made ready to pilot so future analysis can be made in relation to real-world engagement and the embedded evaluative content can be used to provide evidence of intervention effectiveness. Conclusions Using the PBA, which was evolved specifically to improve development of digital interventions, resulted in a workplace intervention embedded with in-depth user input combined with evidenced-based theory. This paper illustrates how using a rigorous methodology can drive the creation of an effective digital health intervention that uniquely allows for refinement at each stage.",0
Effect of Positive Airway Pressure Therapy on Drowsy Driving in a Large Clinic-Based Obstructive Sleep Apnea Cohort,"Study Objectives: Drowsy driving related to obstructive sleep apnea (OSA) represents an important public health problem with limited data on the effect of positive airway pressure (PAP) therapy. We hypothesize that PAP therapy will reduce self-reported drowsy driving in a large clinic-based OSA cohort.Methods: Drowsy driving (self-reported near-accidents/accidents) incidents from baseline to after PAP therapy (stratified by adherence) were compared in a cohort of 2,059 patients with OSA who initiated PAP therapy from January 1, 2010 to December 31, 2014. Multivariable logistic regression models evaluated the dependence of change in drowsy driving incidents on other factors, including change in Epworth Sleepiness Scale (ESS) and Patient Health Questionnaire-9 (PHQ9) scores.Results: In the entire cohort (age 56.0 +/- 13.1 years, 45.4% female, 76.0% white, average follow-up 124.4 +/- 67.3 days), drowsy driving incidents reduced from 14.2 to 6.9% after PAP therapy (P < .001). In subgroups, drowsy driving incidents reduced from 14% to 5.3% (P < .001) in patients who self-reported adherence to PAP therapy and 14.1% to 5.3% (P < .001) in patients objectively adherent to PAP therapy. For each one-point improvement in Epworth Sleepiness Scale score, the odds of drowsy driving decreased by about 14% (odds ratio 0.86, 95% confidence interval 0.82 to 0.90).Conclusions: In this clinic-based cohort, drowsy driving improved after adherent PAP usage, with greater drowsy driving risk for those with greater sleep propensity. This highlights the importance of and need for routine drowsy driving assessments and careful clinical attention to PAP adherence and sleep propensity in this population. Our findings should be confirmed and may be used to provide support for initiatives to address the public health issue of drowsy driving.",0
Development of an observational checklist for falling risk assessment of high-voltage transmission tower construction workers,"Falls from elevation have been reported to cause the highest number of fatalities in the Taiwan construction industry, accounting for 43.53% of all construction worker fatalities for the period from 2006 to 2015, inclusive. High-voltage transmission tower construction is a high-risk operation due to the construction site locations, extreme climatic factors, elevated working surfaces, and narrow working space. However, the factors contributing to the risk of falls in high-voltage transmission tower construction work have not been characterized. This paper describes the development and application of an observational checklist for assessing exposure to fall risks. Three contributing factors, movement, stability, and fall protection measures, were characterized based on the suggestions of ergonomic experts, interviews of supervisors and workers, and on-site observations. Inter observer reliability test results showed that inter-observer reliability of the observational checklist was acceptable to excellent. A pilot study assessing five primary construction operations suggested that position shifting, wherein workers were found to have frequent exposure to the whole-body movement level and spent the least time in a tied-off full body harness, was the operation with the highest fall risk. These results demonstrated that the observational checklist can be used to identify specific construction operations with fall hazards.",0
Pilot Fatigue Evaluation Based on Eye-Movement Index and Performance Index,"Flight fatigue has always been an important factor affecting flight safety, but how to control and identify the state of fatigue is still an unsolved problem. The aim of this study is to explore the changing rules of eye-movement indicator and performance indicator of pilots under fatigue state by building a fatigue model of task load to excite fatigue, so as to provide reference for fatigue identification and evaluation. Thirty participants attended the experiment, which was required to complete three sets of flight parameters dynamic monitoring and control mission of varying difficulty in a controlled laboratory environment. The eye-movement indicators (blink duration time, average saccade amplitude, average pupil diameter) and performance indicators (accuracy, response time) of 30 subjects were measured in three groups of tasks. The experimental results showed that the blink duration time, average saccade amplitude, average pupil diameter and response time were all significantly affected by fatigue, but the accuracy rate was not significantly affected. According to the analysis of experimental data, it is concluded that the blink duration time increases first and then decreases with the increase of fatigue degree. Saccade amplitude average decreased with the increase of fatigue degree. Pupil diameter size decreases gradually with fatigue degree. These eye-movement indexes show good significance and can be used as good indicators to identify and evaluate fatigue state. Fatigue degree also has a significant effect on the response time. When the task load exceeds a certain degree, the response time will increase exponentially, which seriously affects the operation speed of pilot. The experimental results have important reference significance for the identification and evaluation of pilot fatigue.",1
A pilot randomized controlled trial examining the impact of a sleep intervention targeting home routines on young children's (3-6 years) physical activity,"Background Given evidence suggesting that sleep impacts on metabolic processes, interventions targeting sleep may improve child physical activity (PA).Objectives To describe the potential effect of an intervention to increase sleep on young children's (3-6 years) moderate to vigorous PA (MVPA) and total PA. To determine adherence to the intervention, impact on sleep duration as well as feasibility, uptake and acceptability was also assessed.Methods Pilot randomized controlled trial with 76 parent-child dyads randomly allocated to an intervention (n = 38) or control group (n = 38). Parents in the intervention group received a 3-month theory-informed intervention consisting of an online video, a telephone call and two text messages. Child PA was assessed using accelerometers at baseline and approximately 3 months. Parents also completed a sleep log and a telephone interview.Results The consent rate was 41% (76/186). Estimated effect size for the intervention relative to control was 10.8 min/day for MVPA, 2.7 min/day for PA and 0.9 h for sleep. Sixteen (44%) parents accessed the video, and 18 (50%) received the telephone call. Over 40% of parents found the video and telephone call useful/very useful.Conclusions This study reports promising effects that an intervention targeting sleep may improve child MVPA and sleep duration. Some modifications to data collection methods and intervention delivery are needed.",0
