title,abstract,correlations
Respiration monitoring in PACU using ventilation and gas exchange parameters,"The importance of perioperative respiration monitoring is highlighted by high incidences of postoperative respiratory complications unrelated to the original disease. The objectives of this pilot study were to (1) simultaneously acquire respiration rate (RR), tidal volume (TV), minute ventilation (MV), SpO(2) and PetCO(2) from patients in post-anesthesia care unit (PACU) and (2) identify a practical continuous respiration monitoring method by analyzing the acquired data in terms of their ability and reliability in assessing a patient's respiratory status. Thirteen non-intubated patients completed this observational study. A portable electrical impedance tomography (EIT) device was used to acquire RREIT, TV and MV, while PetCO(2), RRCap and SpO(2) were measured by a Capnostream35. Hypoventilation and respiratory events, e.g., apnea and hypopnea, could be detected reliably using RREIT, TV and MV. PetCO(2) and SpO(2) provided the gas exchange information, but were unable to detect hypoventilation in a timely fashion. Although SpO(2) was stable, the sidestream capnography using the oronasal cannula was often unstable and produced fluctuating PetCO(2) values. The coefficient of determination (R-2) value between RREIT and RRCap was 0.65 with a percentage error of 52.5%. Based on our results, we identified RR, TV, MV and SpO(2) as a set of respiratory parameters for robust continuous respiration monitoring of non-intubated patients. Such a respiration monitor with both ventilation and gas exchange parameters would be reliable and could be useful not only for respiration monitoring, but in making PACU discharge decisions and adjusting opioid dosage on general hospital floor. Future studies are needed to evaluate the potential clinical utility of such an integrated respiration monitor.",0
Prehabilitative high-intensity interval training and resistance exercise in patients prior allogeneic stem cell transplantation,"Physical capacity prior allogeneic stem cell transplantation (allo-HCT) has been shown as a relevant prognostic factor for survival after transplant. Therefore, we evaluated feasibility and preliminary efficacy of a high-intensity interval training (HIIT) and moderate to high-intensity resistance exercise (RE) to increase physical capacity in patient's prior allo-HCT. In this multicentre single arm pilot study, a supervised exercise program was performed twice weekly for 4-12 weeks prior allo-HCT, depending on the individual time remaining. Outcomes were feasibility (recruitment, adherence, safety), physical capacity (cardiorespiratory fitness [VO2peak], muscle strength) and patient reported outcomes (physical functioning, fatigue). Thirty patients were intended, 16 could be included, and 14 completed post intervention assessment (75% male, 55 +/- 11 years). The study was stopped early due to a low recruitment rate. Nine patients (64%) reached the initial minimum planned number of eight exercise sessions. Individual adherence was high with 92% for HIIT and 85% for RE. 87% of all performed exercise sessions were completed without complaints and VO2peak increased significantly from 20.4 to 23.4 ml/kg/min. The low recruitment rate suggests that initiation of the intervention concept immediately before allo-HCT is feasible only in a small number of patients. In particular, the timeframe directly prior allo-HCT seems too short for exercise interventions, although the exercise program was designed to improve outcomes in a very short time frame. HIIT and RE were feasible, effective and well accepted by the included patients.",0
Low physical activity in patients diagnosed with head and neck cancer,"Background This pilot study aimed to describe physical activity (PA) and self-perceived function, health and quality of life (QoL) prior to oncological treatment in patients with head and neck cancer (HNC). Methods In a prospective study including 49 patients, self-perceived PA (Saltin-Grimby scale) and health-related QoL (European Organization for Research and Treatment of Cancer Quality of Life questionnaire Core 30 and EQ-5D) were assessed. Further, PA was also measured by an accelerometer attached to the thigh for eight consecutive days. The accelerometer PA was compared to the PA of a reference population assessed with the same method. Results presented are from data collected before start of oncological treatment. Results The patients (44-79 years, 65% males) spent most of their time in sedentary behavior: a median of 555 minutes/day in bed (39% of total) and 606 minutes/day sitting (41%). Only 129 minutes/day were spent moving/walking. Patients with higher education, reduced physical function and higher fatigue were less physically active (P <= .01). Further, the different PA measures demonstrated a pattern of being less physically active compared to the reference population. Conclusions Patients diagnosed for HNC may have low PA level. Assessment of PA from accelerometer data may be an important component of oncological treatment to identify patients in need for PA intervention that may enhance treatment outcome.",0
CCGT unit commitment model with first-principle formulation of cycling costs due to fatigue damage,"Combined cycle gas turbine power plants (CCGTs) play a key role in modern electric power systems due to their operational flexibility and the firmness they provide to the networks where they operate. Due in part to this flexibility and firmness, the function of CCGTs has experienced a significant evolution with the advent of intermittent renewable energy sources such as wind: CCGTs are increasingly required to rapidly vary load levels in order to counterbalance the fluctuations of renewable energy sources and satisfy overall system demand. The purpose of this paper is to develop a methodology that can be used for assessing the optimal operational strategy of a CCGT when subjected to cycling requirements. This is achieved by introducing a unit commitment formulation that takes into account useful life expenditure costs due to fatigue damage accumulation associated to cycling. The case studies presented in this paper show that neglecting fatigue cycling costs when making operational decisions generates suboptimal cost and profit outcomes for CCGT operators. Furthermore, it is shown that profitability of CCGTs is compromised in systems with very significant penetration of intermittent renewable energy sources, due to the increase in cycling costs derived from continuous load-following operation. (C) 2016 Elsevier Ltd. All rights reserved.",0
Determinants of self-perceived quality of life in mildly disabled multiple sclerosis patients: a cross-sectional study,"Introduction While the determinants influencing self-perceived health-related quality of life (spHRQoL) in persons with multiple sclerosis (pwMS) and severe physical impairment have been well investigated, their impact on pwMS with mild disability is poorly addressed. We aimed to investigate possible drivers of spHRQoL among Sardinian pwMS with an EDSS lower than 2.5. Methods A sample of 87 fully ambulatory (EDSS < 2.5) pwMS were included after screening for major cognitive impairment. spHRQoL was measured with the Italian version of 36-Item Short Form Health Survey (SF-36). The Physical Component Summary (PCS) and Mental Component Summary (MCS) were used as dependent variables for univariate analysis with Cognitive Behavioral Assessment (CBA) and specific individual factors as independent variables. Subsequent multivariate general linear models (GLMs) for PCS and MCS respectively were run after stepwise regression. Normative data referring to Italian population were used for comparison. Results As compared to normative data, no statistically significant difference was found for PCS, while MCS was reduced. Multivariate GLMs showed a significant association between lower PCS scores and presence of psychosomatic symptoms, older age and fatigue (p < 0.05). Furthermore, a significant association was shown between lower MCS scores and presence of anxiety (p < 0.001). Conclusion Mood, presence of psychosomatic symptoms, fatigue and age can have a relevant impact on spHRQoL in people with mildly disabling MS and should be considered in the management of such individuals.",0
A Feasibility Study of Group-Delivered Behavioral Interventions for Insomnia Among Breast Cancer Survivors: Comparing Cognitive Behavioral Therapy for Insomnia and a Mind-Body Intervention,"Objectives: An estimated 30%-50% of breast cancer survivors (BCSs) report persistent insomnia, which may affect daytime functioning and quality of life, and lead to longer term health complications. Although the gold standard insomnia intervention, cognitive behavioral therapy for insomnia (CBT-I), has demonstrated efficacy, accessibility is limited due to a scarcity of trained providers, and adherence to therapy is variable. Group-delivered alternative therapies may offer an opportunity to reach and treat BCSs with insomnia. This pilot study was designed to assess feasibility of a group-delivered mind-body intervention compared with group-delivered CBT-I among BCSs. Design: The authors recruited n = 25 stages I - IV BCSs to a 9-week trial of group therapy for insomnia. Eligible women were assigned to the next upcoming group until it was full. Primary outcomes were to assess intervention feasibility measured by (1) qualitative focus group feedback and (2) attendance. The feasibility of using the Insomnia Severity Index (ISI) was also assessed in this population and ISI change scores were gathered to allow for power calculations in a future trial. Means and frequencies were used to describe participant demographics and attendance. Results: The authors found higher attendance (86% vs. 67% of sessions) and greater satisfaction with the intervention (84.6% vs. 57.1%) reported among mind-body participants than among CBT-I participants. Qualitative feedback suggested more group cohesion among the mind-body group and lower incentive to attend in-person among the CBT-I group. Conclusions: The results suggest that delivering a mind-body intervention for BCSs is feasible and acceptable, based on attendance and qualitative feedback.",0
Towards formal verification of ASIP based on HDPN,"Verification is one of the most complex and expensive tasks in current Application Spec fie Instruction-set I Processor (ASIP) design process. Many existing approaches utilize a multi-level strategy to efficiently design and verify ASIP aiming to discover the flaws earlier This paper presents a verification approach based on HDPN (Hardware Design based-on Petri Net) and NuSMV. The validation of static properties, viz. structural and functional description of ASIP architecture, implements with HDPN, and the verification of dynamic properties, viz. logic design, implements with NuSMV In order to check the dynamic properties of HDPN-based models, a scheme of translating from a HDPN description into SMV is discussed in this paper. In addition, a DLX pipelined processor is presented to demonstrate the verification approach.",0
Sjogrens Systemic Clinical Activity Index (SCAI)a systemic disease activity measure for use in clinical trials in primary Sjgrens syndrome,"Objective. This article describes the development of the Sjgren's Systemic Clinical Activity Index (SCAI) for the measurement of systemic disease activity in patients with primary Sjgrens syndrome (PSS).Methods. A pilot tool was developed based on expert consensus and previous published data. One hundred and four patients with PSS were evaluated in a cross-sectional analysis, of whom 65 were reviewed at 3-monthly intervals, using this index, over a 12-month period. Factor analysis was used to evaluate the proposed domain structure. External validation was assessed by comparison with relevant domains of the Profile of Fatigue and Discomfort (PROFAD), Medical Outcomes Study Short Form-36 (SF-36) and The World Health Organization Quality of Life-Bref (WHOQOL-BREF). Sensitivity to change was assessed by comparing SCAI-derived flares with physician-designated disease flare and intention-to-treat analysis. A reliability and repeatability workshop was also held.Results. Factor analysis supported the proposed domain structure. There were strong correlations between the SCAI fatigue, musculoskeletal and Raynauds components and the PROFAD fatigue, arthralgia and vascular domains. There was a significant correlation between change in therapy and SCAI-defined flares (P = 0.01). The mean kappa-test results both for reliability of the SCAI and for physician repeatability were 0.71.Conclusion. This initial evaluation supports the potential for the SCAI as a tool for systemic activity assessment in patients with PSS but additional work is required to assess sensitivity to change in clinical therapeutic trials.",0
"Metabolic, immune and inflammatory responses to a repeated-sprint ability test using FT-IR spectrometry in single blood micro-samples: a pilot study","BACKGROUND: The repeated-sprint ability (RSA) plays a crucial role for determining success in many team sports. Unfortunately, several studies hypothesized that strenuous exercise could cause functional disorders or even some pathologies. These constraints are often associated to different physiological and metabolic disturbances that may reduce the sportive performance or even stop the activity. The purpose of this study was to examine the metabolic, immune and inflammatory responses to a repeated sprint test in trained subjects using a FT-IR spectrometry determination.METHODS: Eleven male football players were required to perform six sprints of six seconds each with 24 seconds of recovery between repetitions. Two blood samples were collected, before and immediately after effort, and 19 parameters related to metabolic, immune and inflammatory responses were assessed by FT-IR spectrometry.RESULTS: This study reported that the total work was positively correlated to the VO2max of subjects (r=0.74; P<0.05) and the lactate concentration (r=0.64; P<0.05). Our results noted also that glucose, lactate, protein, transferrin, Apo-Al, Apo-B, IgG, C-reactive protein, haptoglobin and orosomucoid concentrations increased; however, IgA and IgM concentrations decreased after multiple sprints (P<0.001 for lactate, and P<0.05 for the rest). No significant changes were noted in cholesterol, amino acids and albumin concentrations.CONCLUSIONS: Our data noted that the ability to sprint repeatedly with a short time interval of rest is related to the aerobic system's ability to resynthesize energy, and eliminate lactate during rest periods. Unfortunately, RSA-Test is often associated with different physiological and metabolic disturbances that may lead to a transit immuno-depressive period, and an inflammatory status.",0
"Physical activity, subjective sleep quality and time in bed do not vary by moon phase in German adolescents","Lunar periodicity in human biology and behaviour, particularly sleep, has been reported. However, estimated relationships vary in direction (more or less sleep with full moon) if they exist at all, and studies tend to be so small that there is potential for confounding by weekly or monthly cycles. Lunar variation in physical activity has been posited as a driver of this relationship, but is likewise not well studied. We explore the association between lunar cycle, sleep and physical activity in a population-based sample of 1411 Germans age 14-17years (46% male). Physical activity (daily minutes moderate-to-vigorous activity) was objectively assessed by accelerometry for a total of 8832days between 2011 and 2014. At the same time, time in bed (h) and subjective sleep quality (1-6) were diaried each morning. In models corrected for confounding, we found that lunar phase was not significantly associated with physical activity, subjective sleep quality or time in bed in either sex, regardless of season. Observed relationships varied randomly in direction between models, suggesting artefact. Thus, this large, objectively-measured and well-controlled population of adolescents displayed no lunar periodicity in objective physical activity, subjective sleep quality or time in bed.",0
Design and Implementation of a Driver's Eye State Recognition Algorithm Based on PERCLOS,"In order to improve the general detection accuracy of eye state, this paper puts forward an innovative method for judging human eye state based on PERCLOS. After pretreatment of the eye image, Hough transformation is used for ellipse detection and pupil position. The gray projection variance threshold analysis is then used to help make the final detection. Freeman chain and the Snake model algorithm are used for the corner detection and precise calculation of the height of an open eye. Thus the PERCLOS value and the eye state can be figured out. The performance of our eye state recognition algorithm is validated by more than 1000 images within product database. The statistics result shows that the fatigue detection accuracy rate can meet the need of usage in complex environment.",1
The International development of PROQOL-HCV: An instrument to assess the health-related quality of life of patients treated for Hepatitis C virus,"Background: Hepatitis C virus (HCV) compromises Health-related Quality of Life (HRQL) with detriments to Physical, Mental and Social health domains. Treatment with interferon and ribavirin is associated with side effects which further impair HRQL. New treatments appear potent, effective and tolerable. However, Patient Reported Outcomes instruments that capture the impact on HRQL for people with hepatitis C are largely non-specific and will be needed in the new treatment era. Therefore, we developed a conceptually valid multidimensional model of HCV-specific quality of life and pilot survey instrument, the Patient Reported Outcome Quality of Life survey for HCV (PROQOL-HCV).Methods: HCV patients from France (n = 30), Brazil (n = 20) and Australia (n = 20) were interviewed to investigate HCV-HRQL issues raised in the scientific literature and by treatment specialists. Interviews were recorded, transcribed and translated into English and French.Results: Fifteen content dimensions were derived from the qualitative analysis, refined and fitted to four domains: (1) Physical Health included: fatigue, pain, sleep, sexual impairment and physical activity; (2) Mental Health: psychological distress, psychosocial impact, and cognition; (3) Social Health: support, stigma, social activity, substance use; (4) Treatment: management, side effects, and fear of treatment failure. The impact of some dimensions extended beyond their primary domain including: physical activity, cognition, sleep, sexual impairment, and the three treatment dimensions. A bank of 300 items was constructed to reflect patient reports and, following expert review, reduced to a 72-item pilot questionnaire.Conclusion: We present a conceptually valid multidimensional model of HCV-specific quality of life and the pilot survey instrument, PROQOL-HCV. The model is widely inclusive of the experience of hepatitis C and the first to include the treatment dimension.",0
Optimized Green Operation of LTE Networks in the Presence of Multiple Electricity Providers,"Energy efficiency aspects in cellular networks can significantly contribute to the reduction of greenhouse gas emissions and help to save the environment. The base station (BS) sleeping strategy has become a well-known technique to achieve energy savings by switching off redundant BSs mainly for lightly loaded networks. Besides, introducing renewable energies as alternative power sources becomes a real challenge to network operators. In this paper, we propose a method that reduces the energy consumption of BSs by not only shutting down underutilized BSs but also by optimizing the amounts of energy procured from different retailers (Renewable energy and electricity retailers). We formulate an optimization problem that leads to the maximization of the profit of a Long-Term Evolution (LTE) cellular operator, and at the same time to the minimization of CO2 emissions in green wireless cellular networks without affecting the desired Quality of Service.",0
Morning Versus Evening Bright Light Treatment at Home to Improve Function and Pain Sensitivity for Women with Fibromyalgia: A Pilot Study,"Objective. To test the feasibility, acceptability, and effects of a home-based morning versus evening bright light treatment on function and pain sensitivity in women with fibromyalgia.Design. A single blind randomized study with two treatment arms: 6 days of a 1 hour morning light treatment or 6 days of a 1 hour evening light treatment. Function, pain sensitivity, and circadian timing were assessed before and after treatment.Setting. Participants slept at home, except for two nights in Sleep Center.Participants. Ten women meeting the American College of Rheumatology's diagnostic criteria for fibromyalgia, including normal blood test results.Methods. Self-reported function was assessed with the Fibromyalgia Impact Questionnaire (FIQ). Pain sensitivity was assessed using a heat stimulus that gave measures of threshold and tolerance. Circadian timing was assessed with the dim light melatonin onset.Results. Both morning and evening light treatments led to improvements in function and pain sensitivity. However, only the morning light treatment led to a clinically meaningful improvement in function (>14% reduction from baseline FIQ) and morning light significantly increased pain threshold more than evening light (P < 0.05). Phase advances in circadian timing were associated with an increase in pain tolerance (r = 0.67, P < 0.05).Conclusions. Bright light treatment appears to be a feasible and acceptable adjunctive treatment to women with fibromyalgia. Those who undergo morning light treatment may show improvements in function and pain sensitivity. Advances in circadian timing may be one mechanism by which morning light improves pain sensitivity. Findings can inform the design of a randomized controlled trial.",0
Image Acquisition of Drivers' Fatigue State Based On Fuzzy Evaluation,"The research on monitoring and predicting drivers' fatigue state has remarkable effect on prevention of traffic accidents, using the CCD image sensor camera as the image acquisition device of driver's face and the 940nm infrared emitting diode as the light supplementary device and 3-points light supplementary had been utilized, the light supplementary system had been optimized by the experiment of infrared light supplementary which proceeded by means of combining the orthogonal experiment and expert fuzzy evaluation. The research result makes great sense to the monitoring of drivers' fatigue state and traffic safety",1
Open-Loop Neurofeedback Audiovisual Stimulation: A Pilot Study of Its Potential for Sleep Induction in Older Adults,"This pilot study tested the efficacy of a 30-min audio-visual stimulation (AVS) program for the treatment of chronic insomnia in older adults. Chronic insomnia has been conceptualized as entailing increased cortical high frequency EEG activity at sleep onset and during NREM sleep. We hypothesized that an AVS program gradually descending from 8 to 1 Hz would potentially reduce the excessive cortical activation that is thought to contribute to difficulties with initiating and maintaining sleep. Accordingly, we conducted an intervention study of AVS using a pre-post design. Eight older adults (88 +/- A 8.7 years) complaining of chronic insomnia self-administered a 30-min AVS program nightly at bedtime for one month. Sleep was assessed at baseline and throughout the 4-week intervention. After using AVS for 4 weeks, significant improvement was reported in insomnia symptoms (ISI, p = 0.002) and sleep quality (PSQI, p = 0.004); with moderate to large effect sizes (Partial Eta2: 0.20-0.55)(Cohen's d: 0.7-2.3). The training effect (self-reported sleep improvement) was observed at the end of week one and persisted through the 1-month intervention. The results from this pilot study suggest that further exploration of AVS as a treatment for insomnia is warranted.",0
Vibroacoustic modulation method with arbitrary probe wave frequency based on machine learning algorithms,"The vibro-acoustic modulation (VAM) method assesses the integrity of a structure using modulation of a high-frequency probe wave and a low-frequency pump wave and measuring the modulation index. A large body of studies found that the modulation index could be used for the defection of contact-type defects in different materials. However, it was also found that the performance of this method is dependent on the probe wave frequency selection. To enhance the robustness of this method, researchers made efforts to modify the VAM method raising the complexity of the equipment and related operator skills, creating needs for extra preparation or procedures. All of these limits VAM potential for industrial application. To develop a robust, efficient, and fast VAM-based non-destructive testing method, the machine learning algorithm was employed. The algorithm utilises amplitude of the multiple sidebands of the modulation spectrum as feature variables and the structural integrity as target variables for training and testing the machine learning model. The experimental result shows that the fatigue crack could be detected with an arbitrary probe wave frequency using the applied machine learning approach.",0
