title,abstract,correlations
A dynamic simulator for the ergonomics evaluation of powered torque tools for human assembly,"Purpose - The purpose of this study is to design and develop a testing device to simulate interaction between human hand-arm dynamics, right-angle (RA) computer-controlled power torque tools and joint-tightening task-related variables.Design/methodology/approach - The testing rig can simulate a variety of tools, tasks and operator conditions. The device includes custom data-acquisition electronics and graphical user interface-based software. The simulation of the human hand-arm dynamics is based on the rig's four-bar mechanism-based design and mechanical components that provide adjustable stiffness (via pneumatic cylinder) and mass (via plates) and non-adjustable damping. The stiffness and mass values used are based on an experimentally validated hand-arm model that includes a database of model parameters. This database is with respect to gender and working posture, corresponding to experienced tool operators from a prior study.Findings - The rig measures tool handle force and displacement responses simultaneously. Peak force and displacement coefficients of determination (R2) between rig estimations and human testing measurements were 0.98 and 0.85, respectively, for the same set of tools, tasks and operator conditions. The rig also provides predicted tool operator acceptability ratings, using a data set from a prior study of discomfort in experienced operators during torque tool use.Research limitations/implications - Deviations from linearity may influence handle force and displacement measurements. Stiction (Coulomb friction) in the overall rig, as well as in the air cylinder piston, is neglected. The rig's mechanical damping is not adjustable, despite the fact that human hand-arm damping varies with respect to gender and working posture. Deviations from these assumptions may affect the correlation of the handle force and displacement measurements with those of human testing for the same tool, task and operator conditions.Practical implications - This test rig will allow the rapid assessment of the ergonomic performance of DC torque tools, saving considerable time in lineside applications and reducing the risk of worker injury. DC torque tools are an extremely effective way of increasing production rate and improving torque accuracy. Being a complex dynamic system, however, the performance of DC torque tools varies in each application. Changes in worker mass, damping and stiffness, as well as joint stiffness and tool program, make each application unique. This test rig models all of these factors and allows quick assessment.Social implications - The use of this tool test rig will help to identify and understand risk factors that contribute to musculoskeletal disorders (MSDs) associated with the use of torque tools. Tool operators are subjected to large impulsive handle reaction forces, as joint torque builds up while tightening a fastener. Repeated exposure to such forces is associated with muscle soreness, fatigue and physical stress which are also risk factors for upper extremity injuries (MSDs; e.g. tendinosis, myofascial pain). Eccentric exercise exertions are known to cause damage to muscle tissue in untrained individuals and affect subsequent performance.Originality/value - The rig provides a novel means for quantitative, repeatable dynamic evaluation of RA powered torque tools and objective selection of tightening programs. Compared to current static tool assessment methods, dynamic testing provides a more realistic tool assessment relative to the tool operator's experience. This may lead to improvements in tool or controller design and reduction in associated musculoskeletal discomfort in operators.",0
A Review of Recent Developments in Driver Drowsiness Detection Systems,"Continuous advancements in computing technology and artificial intelligence in the past decade have led to improvements in driver monitoring systems. Numerous experimental studies have collected real driver drowsiness data and applied various artificial intelligence algorithms and feature combinations with the goal of significantly enhancing the performance of these systems in real-time. This paper presents an up-to-date review of the driver drowsiness detection systems implemented over the last decade. The paper illustrates and reviews recent systems using different measures to track and detect drowsiness. Each system falls under one of four possible categories, based on the information used. Each system presented in this paper is associated with a detailed description of the features, classification algorithms, and used datasets. In addition, an evaluation of these systems is presented, in terms of the final classification accuracy, sensitivity, and precision. Furthermore, the paper highlights the recent challenges in the area of driver drowsiness detection, discusses the practicality and reliability of each of the four system types, and presents some of the future trends in the field.",1
A pilot study on the feasibility and effectiveness of treadmill-based perturbations for assessing and improving walking stability in chronic obstructive pulmonary disease,"Background: Falls risk is elevated in chronic obstructive pulmonary disease (COPD). However, there is a lack of evidence regarding the contributing factors. Here, we examined the feasibility of, and initial responses to, large walking perturbations in COPD, as well as the adaptation potential of people with COPD to repeated walking perturbations that might indicate potential for perturbation-based balance training in COPD.Methods: 12 participants with COPD undergoing inpatient pulmonary rehabilitation and 12 age-gender-matched healthy control participants walked on an instrumented treadmill and experienced repeated treadmill-belt ac-celeration perturbations (leading to a forward balance loss). Three-dimensional motion capture was used to quantify the stability of participants body position during perturbed walking. Feasibility, stability following the initial perturbations and adaptation to repeated perturbations were assessed.Findings: Using perturbations in this manner was feasible in this population (no harness assists and participants completed the minimum number of perturbations). No clear, specific deficit in reactive walking stability in COPD was found (no significant effects of participant group on stability or recovery step outcomes). There were mixed results for the adaptability outcomes which overall indicated some adaptability to repeated perturbations, but not to the same extent as the healthy control participants.Interpretation: Treadmill-based perturbations during walking are feasible in COPD. COPD does not appear to result in significant deficits in stability following sudden perturbations and patients do demonstrate some adaptability to repeated perturbations. Perturbation-based balance training may be considered for fall prevention in research and practice in people with COPD.",0
Excessive Daytime Sleepiness as a Risk Factor for Obstructive Sleep Apnoea among Public Transport Drivers: A Cross-Sectional Study.,"Context: Excessive daytime sleepiness (EDS) due to obstructive sleep apnoea (OSA) is reported to be a major contributor to many road traffic accidents. Lack of awareness and diagnosis of OSA among public transport workers remains a threat to the society.Aims: The primary aim of this study was to assess the risk of OSA among transport drivers of south Kerala using modified Berlin questionnaire. The secondary objective included craniofacial assessment of the high-risk patients identified through the questionnaire using lateral cephalogram.Settings and Design: A cross-sectional study was conducted among 180 transport drivers of south Kerala.Methods and Material: Modified Berlin questionnaire and limited physical examination [body mass index (kg/m2), neck circumference (cm), waist circumference (cm), hip circumference and waist to hip ratio, blood pressure (mm Hg)] were recorded. The screened subjects were categorized as high-risk snorers and low-risk snorers based on modified Berlin questionnaire. Craniofacial morphological variations of high-risk group were assessed by lateral cephalograms.Statistical Analysis Used: The descriptive statistics were represented as mean and standard deviation and percentage. Inter-group comparison was performed with independent sample t test.Results: The study demonstrated 64.4% of subjects were non-snorers and 35.6% were snorers. Furthermore, among the snorers, 46.9% were identified as high-risk snorers, whereas the remaining 53.1% represented low-risk snorers.Conclusions: The study revealed the concealed risk of OSA among transport drivers could be screened through the questionnaires and demographics assessment. The application of the proposed screening protocol would triage and enhance safety of OSA affected transport drivers.",1
High-throughput behavioral phenotyping in the expanded panel of BXD recombinant inbred strains,"Genetic reference populations, particularly the BXD recombinant inbred (BXD RI) strains derived from C57BL/6J and DBA/2J mice, are a valuable resource for the discovery of the bio-molecular substrates and genetic drivers responsible for trait variation and covariation. This approach can be profitably applied in the analysis of susceptibility and mechanisms of drug and alcohol use disorders for which many predisposing behaviors may predict the occurrence and manifestation of increased preference for these substances. Many of these traits are modeled by common mouse behavioral assays, facilitating the detection of patterns and sources of genetic coregulation of predisposing phenotypes and substance consumption. Members of the Tennessee Mouse Genome Consortium (TMGC) have obtained phenotype data from over 250 measures related to multiple behavioral assays across several batteries: response to, and withdrawal from cocaine, 3,4-methylenedioxymethamphetamine; ecstasy (MDMA), morphine and alcohol; novelty seeking; behavioral despair and related neurological phenomena; pain sensitivity; stress sensitivity; anxiety; hyperactivity and sleep/wake cycles. All traits have been measured in both sexes in approximately 70 strains of the recently expanded panel of BXD RI strains. Sex differences and heritability estimates were obtained for each trait, and a comparison of early (N = 32) and recent (N = 37) BXD RI lines was performed. Primary data are publicly available for heritability, sex difference and genetic analyses using the MouseTrack database, and are also available in GeneNetwork.org for quantitative trait locus (QTL) detection and genetic analysis of gene expression. Together with the results of related studies, these data form a public resource for integrative systems genetic analysis of neurobehavioral traits.",0
Contact Versus Noncontact Detection of Driver's Drowsiness,"With an estimated number of injuries in the millions, accidents caused due to drowsy driving remain a significant source of financial costs and loss of life. Accurate detection of driver's drowsiness could provide a clear avenue towards eliminating a great majority of the associated accidents and losses. Existing research on the subject could be defined as either contact-based or noncontact-based alertness detection. This paper utilizes a novel multimodal driver's alertness dataset consisting of 45 subjects via seven recorded channels, including four contact-based and three noncontact-based channels, to investigate the performance of said modalities in detecting driver's drowsiness as well as provide a novel comparison between the results of multiple contact and noncontact methods. Our results highlight the viability of noncontact methods to detect driver's drowsiness as an implementable technology in automobiles.",1
Napping on the Night Shift: A Two-Hospital Implementation Project,"Background: Nurses who work the night shift often experience high levels of sleepiness. Napping has been adopted as an effective countermeasure to sleepiness and fatigue in other safety-sensitive industries, but has not had widespread acceptance in nursing.Purpose: To assess the barriers to successful implementation of night-shift naps and to describe the nap experiences of night-shift nurses who took naps.Methods: In this two-hospital pilot implementation project, napping on the night shift was offered to six nursing units for which the executive nursing leadership had given approval. Unit nurse managers' approval was sought, and where granted, further explanation was given to the unit's staff nurses. A nap experience form, which included the Karolinska Sleepiness Scale, was used to assess pre-nap sleepiness level, nap duration and perceived sleep experience, post-nap sleep inertia, and the perceived helpfulness of the nap. Nurse managers and staff nurses were also interviewed at the end of the three-month study period.Results: Successful implementation occurred on only one of the six units, with partial success seen on a second unit. Barriers primarily occurred at the point of seeking the unit nurse managers' approval. On the successful unit, 153 30-minutes naps were taken during the study period. A high level of sleepiness was present at the beginning of 44% of the naps. For more than half the naps, nurses reported achieving either light (43%) or deep (14%) sleep. Sleep inertia was rare. The average score of helpfulness of napping was high (7.3 on a 1-to-10 scale). Nurses who napped reported being less drowsy while driving home after their shift.Conclusion: These data suggest that when barriers to napping are overcome, napping on the night shift is feasible and can reduce nurses' workplace sleepiness and drowsy driving on the way home. Addressing nurse managers' perceptions of and concerns about napping may be essential to successful implementation.",0
The Healthy Lifestyle Habits Screening Questionnaire: A pilot study in the Canary Islands,"Objective: This study aimed to assess the validity and reliability of a self-administered screening questionnaire to detect deficiencies in the health habits of the adult population of the Canary Islands (Spain).Design: The questionnaire initially included 30 items based on previous questionnaires and following the recommendations of the World Health Organization about healthy and unhealthy diet, screen time, physical activity, and sleep habits. It also included a section related to hygiene due to the importance that hygienic habits have in people's health.Setting: The questionnaire was self-administered online.Participants: Data was collected from 401 participants from the Canary Islands (age range: 18-73 years) who volunteered to fill in the questionnaire online.Results: The questionnaire revealed adequate overall reliability indexes (Cronbach's alpha > .70, Mcdonald's omega >.70), and construct validity. Hierarchical linear regression analysis revealed age, sex, and income to be significantly (p <.05) related to adults' health lifestyle habits in our population, sex and age explaining the majority of the variance. However, education and incomes were found non-significant (p >.05) when education was introduced into the model. Those results pointed out that older people and women show healthier lifestyle habits.Conclusion: The questionnaire proved to be a brief, reliable, and valid tool to assess health lifestyle habits in adults in the Canary Islands. Furthermore, results pointed out that in future intervention studies with children, variables such as adults' sex, age, and, to a lesser extent, monthly income should be taken into consideration. (c) 2022 SEEN y SED. Published by Elsevier Espana, S.L.U. All rights reserved.",0
Internet of medical things for smart D3S to enable road safety,"It has been seen that most of the accidents occur due to driver's fatigue. Drowsiness is a state of mind before the driver falls asleep, which means the driver could not accomplish his actions, such as vehicular braking, controlling vehicular motion, properly. We have built an Internet of things-based medical application to analyze driver's drowsiness. An architecture has been proposed and a simulation of that scenario in NS3 WSN simulation tool has been done. This simulation shows that the ratio of accidents can be majorly reduced. When drowsiness of drivers is captured, a message alert is delivered to all other drivers of the vehicles that are near to the sleeping driver; for this, different sensor nodes are used. Another unique feature of the sensor network used here is the collaborative effect of sensor nodes. So for measurement and analysis of applications on Google Play, a dataset of the medical applications category was scraped. The scraping was done with 550 applications of each category of medical applications. On each application on Google Play store, almost 70 attributes for each category were scraped. It is envisioned that, in future, wireless sensor networks will be an integral part of our lives, more so than the present-day personal computers.",1
"Comparison of cognitive behaviour therapy versus activity management, both delivered remotely, to treat paediatric chronic fatigue syndrome/myalgic encephalomyelitis: the UK FITNET-NHS RCT","Design: Parallel-group randomised controlled trial. Methods: Participants:Adolescents aged 11-17 years, diagnosed with myalgic encephalomyelitis/chronic fatigue syndrome and with no local specialist treatment centre, were referred to a specialist service in South West England. Interventions:Fatigue In Teenagers on the interNET in the National Health Service is a web-based myalgic encephalomyelitis/chronic fatigue syndrome-focused cognitive-behavioural therapy programme for adolescents, supported by individualised written, asynchronous electronic consultations with a clinical psychologist/cognitive-behavioural therapy practitioner. The comparator was videocall-delivered activity management with a myalgic encephalomyelitis/chronic fatigue syndrome clinician. Both treatments were intended to last 6 months. Objectives:Estimate the effectiveness of Fatigue In Teenagers on the interNET in the National Health Service compared to Activity Management for paediatric myalgic encephalomyelitis/chronic fatigue syndrome. Estimate the effectiveness of Fatigue In Teenagers on the interNET in the National Health Service compared to Activity Management for those with mild/moderate comorbid mood disorders. From a National Health Service perspective, estimate the cost-effectiveness of Fatigue In Teenagers on the interNET in the National Health Service compared to Activity Management over a 12-month horizon.Primary Outcome:36-item Short Form Health Survey Physical Function subscale at 6 months post randomisation.Randomisation:Web-based, using minimisation with a random component to balance allocated groups by age and gender.Blinding:While the investigators were blinded to group assignment, this was not possible for participants, parents/carers and therapists.Results: The treatment of 314 adolescents was randomly allocated, 155 to Fatigue In Teenagers on the interNET in the National Health Service. Mean age was 14 years old and 63% were female.Primary outcome: At 6 months, participants allocated to Fatigue In Teenagers on the interNET in the National Health Service were more likely to have improved physical function (mean 60.5, standard deviation 29.5, n = 127) compared to Activity Management (mean 50.3, standard deviation 26.5, n = 138). The mean difference was 8.2 (95% confidence interval 2.7 to 13.6, p = 0.003). The result was similar for participants meeting the National Institute for Health and Care Excellence 2021 diagnostic criteria.Secondary outcomes: Fatigue In Teenagers on the interNET in the National Health Service participants attended, on average, half a day more school per week at 6 months than those allocated Activity Management, and this difference was maintained at 12 months. There was no strong evidence that comorbid mood disorder impacted upon the relative effectiveness of the two interventions. Similar improvement was seen in the two groups for pain and the Clinical Global Impression scale, with a mixed picture for fatigue. Both groups continued to improve, and no clear difference in physical function remained at 12 months [difference in means 4.4 (95% confidence interval -1.7 to 10.5)].One or more of the pre-defined measures of a worsening condition in participants during treatment, combining therapist and patient reports, were met by 39 (25%) participants in the Fatigue In Teenagers on the interNET in the National Health Service group and 42 (26%) participants in the Activity Management group.A small gain was observed for the Fatigue In Teenagers on the interNET in the National Health Service group compared to Activity Management in quality-adjusted life-years (0.002, 95% confidence interval -0.041 to 0.045). From an National Health Service perspective, the costs were 1047.51 pound greater in the Fatigue In Teenagers on the interNET in the National Health Service group (95% confidence interval 624.61 pound to 1470.41) pound. At a base cost-effectiveness threshold of 20,000 pound per quality-adjusted life-year, the incremental cost-effectiveness ratio was 457,721 pound with incremental net benefit of -1001 pound (95% confidence interval -2041 pound to 38) pound. Conclusion: At 6 months post randomisation, compared with Activity Management, Fatigue In Teenagers on the interNET in the National Health Service improved physical function and school attendance. The additional cost of Fatigue In Teenagers on the interNET in the National Health Service and limited sustained impact mean it is unlikely to be cost-effective. Trial registration: This trial is registered as ISRCTN18020851 .Funding: This award was funded by the National Institute for Health and Care Research (NIHR) Health Technology Assessment programme (NIHR award ref: 14/192/109) and is published in full in Health Technology Assessment; Vol. 28, No. 70. See the NIHR Funding and Awards website for further award information.",0
"The effects of 37 hours of continuous wakefulness on the physiological arousal, cognitive performance, self-reported mood, and simulator flight performance of F-117A pilots","Pilot fatigue poses a serious threat to operational safety, but understanding the nature of the problem and the times at which pilots are most at risk will facilitate operationally relevant fatigue-management strategies. This investigation sought to address these issues in a controlled investigation of the impact of sustained wakefulness on Air Force aviators. Ten current and qualified F-I 17 pilots completed the Multi-Attribute Task Battery (MATB), the Profile of Mood States (POMS), a resting eyes-open and eyes-closed EEG, and a standardized flight evaluation in an F-117 flight simulator at 5-hr intervals during the final 23 hours of a 37-hr period of continuous wakefulness. Results indicated significant decrements in mood, cognition, central nervous system activation, and flight skills began to occur in the predawn hours during a night without sleep. However, the most serious operationally relevant decrements appeared at approximately 0700 (after 25 hours without sleep) and persisted throughout the remainder of the deprivation period. The decrements suggested in the real world crew coordination likely will decline, information processing will become impaired, and a wide array of basic capabilities will be degraded as a result of compromised vigilance, poor situational awareness, and sluggish reaction time. Even the well-practiced flight skills of experienced pilots are clearly susceptible to the insidious effects of sleep loss. These quantified effects of untreated sleep deprivation will provide a baseline against which promising fatigue countermeasures can be assessed.",1
Treating Electrical and Biopotential Artifacts in an EEG Pilot Study Experiment,"With the increase in life expectancy, as well as in the performance and complexity of healthcare systems, the need for fast and accurate information has also grown. EEG devices have become more accessible and necessary in clinical practice. In daily activity, artifacts are ubiquitous in EEG signals. They arise from: environmental, experimental and physiological factors, degrade signal quality and render the affected part of the signal useless. This paper proposes an artifact cleaning pipeline including filters and algorithms to streamline the analysis process. Moreover, to better characterize and discriminate artifacts from useful EEG data, additional physiological signals and video data are used, which are correlated with subject's behavior. We quantify the performance reached by Peak Signalto-Noise Ratio and clinical visual inspection. The entire research and data collection took place in the laboratories of XPERI Corporation.",0
