title,abstract,correlations
Development of a design verification methodology including strength and fatigue life prediction for agricultural tractors,"During the operations of an agricultural tractor, front axle and front axle support encounter the worst load conditions of the whole tractor. If the design of these components is not verified by systematic engineering approach, the operators of the tractor may face with sudden failures. This paper aims to develop a verification method, which involves testing an agricultural tractor on a special test track and agricultural field and together with the computer aided engineering analysis, in order to prevent such failures in the lifetime of the agricultural tractor. For this purpose, a strain gage data acquisition system has been designed to measure the strain values on the component in order to determine maximum principle stresses for the calculation of overload safety on the agricultural field and stress data for the prediction of fatigue life on a radial washboard test track. The cycle number of these stress data for the fatigue analysis has been established by rainflow cycle counting method. Total fatigue damage for the front axle support has been calculated considering damage accumulation hypothesis defined by Miner.",0
A brain-computer interface based semi-autonomous robotic system,"Brain-computer interface (BCI) takes commands directly from the users brain via electroencephalogram (EEG), which offers a solution for controlling the robotic system when users hands are disabled or occupied. This paper describes a semi-autonomous robotic system that is able to execute grasping tasks based on BCI, thus offering an alternative control approach for robotic system. As BCI has limited information transfer rate and can easily cause fatigue in using, we utilize a stereo camera for object localization and convolutional neural network (you only look once version3, YOLOv3) for object identification to reduce the information needed from the brain in task execution, thus alleviating the workload for the user as well as increasing the efficiency of the system.",0
Clinical reminder alert fatigue in healthcare: a systematic literature review protocol using qualitative evidence,"Background: Integrated reminders within clinical systems have become more prevalent due to the use of electronic health records and evidence demonstrating an increase in compliance within practice. Clinical reminders are assessed for effectiveness on an individual basis, rather than in combination with existing prompts for other conditions. The growing number of prompts may be counter-productive as healthcare professionals are increasingly suffering from reminder fatigue meaning many reminders are ignored. This work will review the qualitative evidence to identify barriers and enablers of existing prompts found within computerised decision support systems. Our focus will be on primary care where clinicians have to negotiate a plethora of reminders as they deal with increasingly complex patients and sophisticated treatment regimes. The review will provide a greater understanding of existing systems and the way clinicians interact with them to inform the development of more effective and targeted clinical reminders.Methods: A comprehensive search using piloted terms will be used to identify relevant literature from 1960 (or commencement of database) to 2017. MEDLINE, MEDLINE In Process, EMBASE, HMIC, PsycINFO, CDSR DARE, HTA, CINAHL and CPCI, will be searched, as well as grey literature and references and citations of included papers. Manuscripts will be assessed for eligibility, bias and quality using the CASP tool with narrative data being included and questionnaire based studies excluded. Inductive thematic analysis will be performed in order to produce a conceptual framework defining the key barriers around integrated clinical reminders.Discussion: Indications of alert and reminder fatigue are found throughout the current literature. However, this has not been fully investigated using a robust qualitative approach, particularly in a rapidly growing body of evidence. This review will aid people forming new clinical systems so that alerts can be incorporated appropriately.",0
The influence of temperature and interior ambient lighting color on nighttime driving performance,"Interior ambient lighting has been applied in high-end vehicles to improve driving experience and emotion, owing to the drivers' perceptions of interior spaciousness and ability to control the vehicle interior environment. Although the influence of temperature and lighting is well-documented in buildings, their effects on driving remain underexplored. Drawing on the hue-heat hypothesis, this study examines the impact of ambient temperatures and interior lighting conditions on driving performance and environmental perception, focusing on their independent and interactive effects. Seventy-two drivers were randomly assigned to three temperature groups (18 degrees C, 23 degrees C, and 28 degrees C) and completed driving tasks in a high-fidelity simulator under varying interior lighting conditions (red, blue, warm white, and cool white). Performance was assessed alongside secondary tasks to simulate real-world driving distractions. Post-task surveys gauged sleepiness, environmental satisfaction, task load, and emotional state. The results show that temperature significantly affects driving performance, cognitive tasks, and environmental perception. Moderate temperatures were preferred for comfort, while higher temperatures impaired accuracy and increased cognitive strain. Metrics like pitch, speed variability, and gas pedal usage were also temperature sensitive. Conversely, lighting condition did not significantly influence driving performance, cognitive tasks, or environmental perception, providing no evidence to support the hue-heat hypothesis. Furthermore, no significant interaction effects were found between temperatures and lighting conditions on any of these metrics, confirming their independent impact. The study underscores the significant role of temperature in influencing driving behavior and perception, while confirming that non-significant effect of lighting condition on driving performance.",0
Word Learning as a Window to Memory and Rehabilitation Outcomes in Traumatic Brain Injury,"Purpose: The purpose of this viewpoint is to advocate for increased study of word learning abilities and word learning interventions in traumatic brain injury (TBI).Method: We describe the word learning process and the unique opportunities afforded by studying each component and stage. Building on discussions at the 2022 International Cognitive-Communication Disorders Conference, we describe how word learning may underlie a variety of functional outcomes after TBI, making it a promising target for rehabilitation. Finally, we discuss principles that may guide study in this critical area to advance outcomes after TBI for children and adults.Results: Word learning is a dynamic and iterative process taking place over time and in multiple stages. Thus, studying word learning affords the opportunity to parse the relative contributions of multiple memory systems to different phases and components of the process. However, single-timepoint designs are insufficient to capture the full word learning process, which occurs over time and across contexts. Word learning also presents an opportunity to assess the contributions of behavioral and lifestyle factors (e.g., sleep and exercise) to different memory phases. Understanding these interactions could drive clinical interventions aimed at improving memory through manipulable external behaviors.Conclusions: Word learning is key to success in functional spheres across the life span. The importance of words to daily life remains after TBI, even as the memory systems that support word learning are disrupted. The empirical study of word learning and rehabilitation of word learning deficits in TBI presents a promising new direction in understanding the breadth of neurogenic cognitivecommunication disorders and an opportunity to explore a potential driver of functional outcome and impactful rehabilitation target.",0
Role of acupuncture in the management of diabetic painful neuropathy (DPN): a pilot RCT,"Aims To examine the role of acupuncture in the treatment of diabetic painful neuropathy (DPN) using a single-blind, placebo-controlled RCT and to collect data that would be required in a future definitive study of the efficacy of acupuncture in DPN.Methods 45 patients were allocated to receive a 10-week course either of real (53%) or sham (47%) acupuncture. Five standardised acupuncture points on the lower limb of each leg were used in the study: LR3, KI3, SP6, SP10 and ST36. Outcome measures included the Leeds Assessment of Neuropathic Symptoms and Signs (LANSS) scale, lower limb pain (Visual Analogue Scale, VAS); Sleep Problem Scale (SPS); Measure Yourself Medical Outcome Profile (MYMOP); 36-item Short Form 36 Health Survey and resting blood pressure (BP).Results Over the 10-week treatment period, small improvements were seen in VAS - 15 (-26 to -3.5), MYMOP -0.89 (-1.4 to -0.3), SPS -2.5 (-4.2 to -0.82) and resting diastolic BP -5.2 (-10.4 to -0.14) in the true acupuncture group. In contrast, there was little change in those receiving sham acupuncture. A moderate treatment effect in favour of active acupuncture was detected in MYMOP scores -0.66 (-0.96 to -0.35) but nonsignificant effect sizes in LANSS Pain Scale -0.37 (-2.2 to 1.4), resting diastolic BP -0.50 (-3.0 to 1.99) and the SPS -0.51 (-2.2 to 1.16).Conclusions We have demonstrated the practicality and feasibility of acupuncture as an additional treatment for people with DPN. The treatment was well tolerated with no appreciable side effects. Larger randomised trials are needed to confirm the clinical and cost-effectiveness of acupuncture in the treatment of DPN.",0
Objective physical activity and self-reported quality of life in patients receiving palliative chemotherapy,"There is little objective data on how cancer and its therapy affect physical activity. The main aims of this Pilot study were 1) to compare physical activity in patients receiving palliative chemotherapy and healthy controls, and 2) to explore the relationship between patients' activity, quality of life (QoL), and clinical performance status. A miniaturized electronic meter objectively recorded activity for one week in 20 patients with upper gastrointestinal cancer receiving palliative chemotherapy and in 13 age-matched healthy controls. Patients also completed the European Organization for Research and Treatment of Cancer (EORTC) QLQC30, Functional Assessment of Chronic Illness Therapy-Fatigue (FACIT-F; fatigue), and Functional Assessment of Anorexia and Cachexia Therapy (FAACT; anorexia/cachexia) quality-of-life questionnaires. The patients' median estimated total energy expenditure was 8 % lower (P = 0.0003), median time spent upright was approximately two hours/day less (P = 0.0002), and median steps taken/day was 43 % lower (P = 0.002) than that of the control group. Neither estimated energy expenditure nor average steps taken/day correlated significantly with EORTC QLQC30 physical functioning, ftiligue, or global health status/QoL. There was no correlation with the FAACT Trial Outcome Index (TOI), but the FACIT-F TOI and both estimated energy expenditure and the average steps taken/day correlated significantly (r = 0. 59, P = 0. 009 and r = 0.59, P = 0.008). It is concluded that patients receiving palliative chemotherapy were less active than healthy controls; however the relationship between physical activity",0
Radar-based sleep stage classification in children undergoing polysomnography: a pilot-study,"Study objectives: Unobtrusive monitoring of sleep and sleep disorders in children presents challenges. We investigated the possibility of using Ultra-Wide band (UWB) radar to measure sleep in children.Methods: Thirty-two children scheduled to undergo a clinical polysomnography participated; their ages ranged from 2 months to 14 years. During the polysomnography, the children's body movements and breathing rate were measured by an UWB-radar. A total of 38 features were calculated from the motion signals and breathing rate obtained from the raw radar signals. Adaptive boosting was used as machine learning classifier to estimate sleep stages, with polysomnography as gold standard method for comparison.Results: Data of all participants combined, this study achieved a Cohen's Kappa coefficient of 0.67 and an overall accuracy of 89.8% for wake and sleep classification, a Kappa of 0.47 and an accuracy of 72.9% for wake, rapid-eye-movement (REM) sleep, and non-REM sleep classification, and a Kappa of 0.43 and an accuracy of 58.0% for wake, REM sleep, light sleep and deep sleep classification.Conclusion: Although the current performance is not sufficient for clinical use yet, UWB radar is a promising method for non-contact sleep analysis in children. (C) 2021 The Author(s). Published by Elsevier B.V.",0
Comparative utility of instruments for monitoring sleepiness-related performance decrements in the operational environment,"As both military and commercial operations increasingly become continuous, 24-h-per-day enterprises, the likelihood of operator errors or inefficiencies caused by sleep loss and/or circadian desynchrony also increases. Avoidance of such incidents requires the timely application of appropriate interventions - which, in turn, depend on the ability to measure and monitor the performance capacity of individuals in the operational environment. Several factors determine the potential suitability of candidate measures, including their relative sensitivity, reliability, content validity, intrusiveness and cumbersomeness/fieldability. In the present study, the relative sensitivity (defined as the ratio of effect size to 95% confidence interval) of several measures to the effects of sleep loss was compared in a sleep restriction experiment, in which groups were allowed 3, 5, 7, or 9 h time in bed (TIB) across seven consecutive nights. Of the measures compared, the Psychomotor Vigilance Test was among the most sensitive to sleep restriction, was among the most reliable with no evidence of learning over repeated administrations, and possesses characteristics that make it among the most practical for use in the operational environment.",1
Established and novel measures of upper limb impairment in children with Charcot-Marie-tooth disease type 1A and riboflavin transporter deficiency type 2,"Hand function is a problem in patients with Charcot-Marie-Tooth disease type 1A (CMT1A) and Riboflavin Transporter Deficiency type 2 (RTD2). However, a detailed understanding of upper limb involvement in these conditions is lacking. The aim of this pilot study was to compare hand and upper limb function between children with CMT1A, RTD2 and healthy controls using established and novel outcome measures. Three age-and sex-matched groups of four children (5-15years, 1 male/group) with CMT1A, RTD2, and healthy controls were assessed for function, strength, and sensation. Fatigue and muscle activity of the FDI was also assessed using a submaximal contraction at 40% of the participants' maximal voluntary contraction. Functional measures were most affected in children with RTD2 followed by children with CMT1A, compared to healthy controls. Strength was similarly impaired in CMT1A and RTD2 compared to controls (p<0.05). Sensation was significantly impaired in RTD2 compared to CMT1A and controls (p=0.008). While time to fatigue did not differ between groups, a decline in muscle activity while force remained constant showed that controls compensated with other muscles during the fatigue task while children with CMT1A and RTD2 did not have this compensatory ability. Children with CMT1A and RTD2 exhibited marked hand/upper limb impairment. These results suggest the upper limb should be a focus of rehabilitative therapy in affected children using sensitive outcome measures of strength and sensation, as well as functional activities of daily living, which are most relevant to the patient.",0
Industrial Application of AI-Based Assistive Magnetic Particle Inspection,"Magnetic Particle Inspection (MPI) is one of the most used methods in Non-Destructive Testing (NDT), allowing precise and robust defect detection on industrial-grade manufactured parts. However, human controllers perform this task in full black environments under UV-A lighting only (with safety glasses) and use chemical products in a confined environment. Those constraints tends to lower control performance and increase stress and fatigue. As a solution, we propose an AI-based assistive machine (called PARADES) inside the hazardous environment, remotely manipulated by a human operator, outside of the confined area, in cleaner and safer conditions. This paper focuses on the development of a complete industrial-grade AI machine, both in terms of hardware and software. The result is a standalone assistive AI-based vision system, plug-and-play and controller-friendly, which only needs the usual power supply 230 V plug that detects defects and measures defect length. In conclusion, the PARADES machines address for the first time the problem of occupational health in MPI with an industrial standalone machine which can work on several parts and be integrated into current production lines. Providing cleaner and healthier working conditions for operators will invariably lead to increased quality of detection. These results suggest that it would be beneficial to spread this kind of AI-based assistive technology in NDT, in particular MPI, but also in Fluorescent Penetrant Testing (FPT) or in visual inspection.",0
"Sunlight Exposure, Work Hours, Caffeine Consumption, and Sleep Duration in the Naval Environment","BACKGROUND: Sailors in the U.S. Navy are habitual shiftworkers, often experiencing circadian misalignment due to their irregular work/rest schedules. This study assessed the effect of sunlight exposure, work hours, and caffeinated beverage consumption on the daily sleep duration of crewmembers of a U.S. Navy ship during a 2-wk underway period.METHODS: Working in an artificially lit area with no access to sunlight during work hours, U.S. Navy crew members (N = 91) used daily logs to report their daily activity, caffeinated beverage consumption, and exposure to sunlight while off-duty; sleep was assessed by wrist-worn actigraphy.RESULTS: Hours of sunlight exposure, work duration, and the amount of coffee/tea/soft drinks were statistically significant predictors of sleep duration. On average, crewmembers who reported more than one half-hour of sunlight each day slept on average similar to 40 min (10%) less than their peers working the same shifts who received less than one half-hour of sunlight (on average 6.05 +/- 0.90 h vs. 6.71 +/- 0.91 h, respectively).DISCUSSION: Exposure to sunlight, work hours, and consumption of caffeinated beverages are important factors when planning watchstanding schedules at sea. Even though further research is needed, our results suggest that even brief exposure to sunlight may contribute to circadian misalignment that negatively affects sleep in the operational environment. Educating crewmembers about sleep hygiene, especially the important roles played by sunlight and caffeine, could potentially improve the sleep and fatigue levels of this population of maritime shiftworkers.",0
Sleep in Hospitalized Elders: A Pilot Study,"Hospitalized elders frequently experience disturbed sleep related to environmental factors. To determine relationships between sleep and environmental noise and light, a descriptive exploratory study was conducted with 48 hospitalized older adults. Participants aged 70 years or older were monitored for sleep via wrist actigraphy, and noise and light levels were measured the first night of hospitalization. Sleep time was brief (mean, 3.75 hours) and fragmented (mean, 13 awakenings per night). The sleep environment was noisy with a median sound level of 49.65 dB(A). There was an average of 3 periods of elevated light levels (mean, 64 lux) lasting an average of 1.75 hours each night. No significant correlation was found among sleep and age, light, and sound. Recommendations include light and sound reduction measures and dedicated do not disturb times to allow for a full 90-minute sleep cycle. (Geriatr Nurs 2010;31: 263-271)",0
"Serum Calcium and Magnesium Levels, Not 25-Hydroxyvitamin D, Are Associated With Sleep Quality in Airline Pilots.","INTRODUCTION: Despite the vulnerability of airline pilots (APs) to sleep disturbances, the biological underpinnings responsible for this phenomenon are still not entirely elucidated. However, there is an increasing amount of evidence indicating an association between 25-hydroxyvitamin D, Ca2+, and Mg2+ levelsand sleep health. In this cross-sectional study, we sought to examine the potential associations between serum levels of these biomarkers and the occurrence of poor sleep among APs.METHODS: We examined a convenience sample of 100male APs who underwent the Pittsburgh Sleep Quality Index (PSQI) to assess their sleep quality. Those who scored 5 or higher on the PSQI were labeled as poor sleepers. Serum levels of 25-hydroxyvitamin D, Ca2+, and Mg2+ were quantified in all participants.RESULTS: Out of the 100 APs, 58 (58%) and 42 (42%) were classified as good and poor sleepers, respectively, based on the PSQI scores. We defined vitamin D deficiency as serum 25-hydroxyvitamin D levels below 10 ng/mL and insufficiency as levels ranging from 10 to 30 ng/mL. The results revealed no significant differences in serum levels of 25-hydroxyvitamin D between the two groups, and there was no evidence of vitamin D deficiency or insufficiency. However, poor sleepers exhibited significantly lower levels of both Mg2+ (1.8 ± 0.1 mg/dLversus2.0 ± 0.1 mg/dL, respectively) and Ca2+ (8.5 ± 0.4mg/dLversus9.1 ± 0.5 mg/dL, respectively) compared to good sleepers (P < 0.001 for both). Logistic regression analysis identified both Mg2+ and Ca2+ as independent biomarkers associated with poor sleep quality in APs (P < 0.001 for both).CONCLUSION: Lower serum concentrations of Mg2+ and Ca2+, not 25-hydroxyvitamin D, may be associated with poor sleep in APs.",0
Real-time eye detection and tracking for driver observation under various light conditions,"Eye tracking is one of the key technologies for future driver assistance systems since human eyes contain much information about the driver's condition such as gaze, attention level, and fatigue level. Thus, nonintrusive methods for eye detection and tracking are important for many applications of vision-based driver-automotive interaction. One problem common to many eye tracking methods proposed so far is their sensitivity to lighting condition change. This tends to significantly limit their scope for automotive applications. In this paper we present a new real-time eye detection and tracking method that works under variable and realistic lighting conditions. By combining imaging by using IR light and appearance-based object recognition techniques, our method can robustly track eyes even when the pupils are not very bright due to significant external illumination interferences. The appearance model is incorporated in both eye detection and tracking via the use of a support vector machine and mean shift tracking. Our experimental results show the feasibility of our approach and the validity for the method is extended for drivers wearing sunglasses.",1
Cardiac Autonomic Activity in Commercial Aircrew During an Actual Flight Duty Period,"BACKGROUND: The work schedules of airline crewmembers include extended workdays, compressed work periods, and limited time for recovery, which may lead to cardiovascular strain and fatigue.The aim of this study was to evaluate changes in heart rate variability (HRV) during work and sleep, and with respect to work characteristics and breaks.METHODS: We followed 49 airline crewmembers during four consecutive workdays of >= 39 h. Data included HRV measurements, a questionnaire, and sleep/work diaries. HRV parameters include root mean square of successive differences (RMSSD), standard deviation of the normal beat-to-beat differences (SDNN), and the low and high frequency ratio (LF/HF).RESULTS: The results indicate higher levels of cardiovascular strain on the 4th compared to the 1st workday, most prominent among cabin crewmembers. In this group, we observed indications of decreased cardiovascular strain by increasing duration of sleep, demonstrated by increased RMSSD (B = 2.7, 95% CI 1.6, 3.8) and SDNN (B - 4.4, 95% CI 3.0, 5.7), and decreased LF/HF (B = - 0.2, 95% CI, -0.4, -0.01). Similarly, longer duration of breaks was associated with lower cardiovascular strain, indicated by increased RMSSD (B = 0.1, 95% CI 0.03, 0.1) and SDNN (B = 0.1, 95% CI 0.1, 0.1). Among pilots, increased LF/HF indicated higher cardiovascular strain in those who often or always reported of high workload (B = 4.3, 95% CI 2.3, 6.3; and B = 7.3, 95% CI 3 2, 11.4, respectively).DISCUSSION: The results support the contention that the studied work period increases cardiac strain among airline crew. Work characteristics, breaks, and sleep are associated with changes in HRV.",0
